{"action":"commit.apply","approvalRefs":[{"id":"approval-001","sha256":"ffffffffffffffffffffffffffffffffffffffffffffffffffffffffffffffff"}],"artifacts":[{"contentType":"text/x-diff","id":"artifact-diff-001","kind":"diff","redactionStatus":"redacted","sha256":"3333333333333333333333333333333333333333333333333333333333333333","sizeBytes":120}],"attempt":1,"correlation":{"agentId":"codex","itemId":"KG-TSK-0124","mode":"koa","producerId":"koa-worker","productId":"kano-git-master-skill","requestId":"request-001","routeId":"local-kog","topicId":"kog-agent-first-audit-console","workOrderId":"work-order-001"},"eventId":"legacy/aaaaaaaaaaaaaaaaaaaaaaaaaaaaaaaaaaaaaaaaaaaaaaaaaaaaaaaaaaaaaaaaaaaaaaaaaaaaaaaaaaaaaaaaaaaaaaaaaaaaaaaaaaaaaaaaaaaaaaaaaaaaaaaaaaaaaaaaaaaaaaaa#id","finishedAtUtc":"2026-07-30T08:00:02Z","outcome":{"exitCode":0,"reasonCode":null,"retryable":false,"status":"succeeded"},"parentRunId":null,"phase":"mutation","planId":"plan-001","planSha256":"cccccccccccccccccccccccccccccccccccccccccccccccccccccccccccccccc","policyRefs":[{"id":"policy-safe-push","sha256":"eeeeeeeeeeeeeeeeeeeeeeeeeeeeeeeeeeeeeeeeeeeeeeeeeeeeeeeeeeeeeeee"}],"repository":{"after":{"ahead":0,"behind":0,"branch":"main","dirtyFingerprint":"2222222222222222222222222222222222222222222222222222222222222222","headSha":"bbbbbbbbbbbbbbbbbbbbbbbbbbbbbbbbbbbbbbbb","upstreamHeadSha":"bbbbbbbbbbbbbbbbbbbbbbbbbbbbbbbbbbbbbbbb","worktreeState":"clean"},"before":{"ahead":null,"behind":null,"branch":"main","dirtyFingerprint":"1111111111111111111111111111111111111111111111111111111111111111","headSha":"aaaaaaaaaaaaaaaaaaaaaaaaaaaaaaaaaaaaaaaa","upstreamHeadSha":null,"worktreeState":"dirty"},"id":"repos/kog"},"runId":"koa-run-001","schemaName":"kog.auditEvent","schemaVersion":1,"sequence":1,"startedAtUtc":"2026-07-30T08:00:00Z"}
